<?xml version="1.0" encoding="UTF-8" ?>
<configuration xmlns:xsi="http://www.w3.org/2001/XMLSchema-instance"
               xsi:noNamespaceSchemaLocation="../../../../../../config.xsd">
    <repositories>
        <repository name="sherlock-repository"
                    url="https://gitlab.example.com/sherlock/holmes.git"
                    upsource-project-id="upsource"
                    gitlab-project-id="5"/>
    </repositories>
    <rule diffAlgorithm="patience"
          ignoreAllSpace="true"
          ignoreBlankLines="true"
          ignoreSpaceAtEol="false"
          ignoreSpaceChange="true"
          excludeMergeCommits="false"
          theme="upsource"
          frequency="once-per-hour"
    >
        <name>Example rules</name>
        <repositories>
            <repository name="sherlock-repository"/>
        </repositories>
        <recipients>
            <recipient email="sherlock@example.com" name="Sherlock Holmes"/>
        </recipients>
        <subject>subject</subject>
        <external_links>
            <external_link pattern="B#{}" url="https://example.com/entity/id/{}"/>
            <external_link pattern="US#{}" url="https://example.com/entity/id/{}"/>
        </external_links>
        <exclude>
            <subject>subject</subject>
            <file>file</file>
            <author>author</author>
        </exclude>
    </rule>
</configuration>
