<?xml version="1.0" encoding="UTF-8" ?>
<configuration xmlns:xsi="http://www.w3.org/2001/XMLSchema-instance"
               xsi:noNamespaceSchemaLocation="../../../../../../config.xsd">
    <repositories>
        <repository name="sherlock" url="https://gitlab.example.com/sherlock/holmes.git"/>
    </repositories>
    <rule>
        <name>Example rules</name>
        <repositories>
            <repository name="sherlock"/>
        </repositories>
        <recipients>
            <recipient email="sherlock@example.com" name="Sherlock Holmes"/>
        </recipients>
    </rule>
</configuration>
